{
  "$schema": "https://json-schema.org/draft/2020-12/schema",
  "$id": "errata-patch.schema.json",
  "title": "Errata overlay applied to a data table at build time (RFC 6902 operations)",
  "type": "object",
  "required": ["id", "table", "affects", "sources", "summary", "patches"],
  "additionalProperties": false,
  "properties": {
    "id": {"type": "string", "pattern": "^E-[0-9]{3}$"},
    "table": {"type": "string", "pattern": "^[a-z0-9-]+$", "description": "data/tables/<table>.json"},
    "affects": {"type": "array", "minItems": 1, "items": {"type": "string", "pattern": "^[1-9][0-9]?\\.[0-9]{1,2}$"}},
    "sources": {"$ref": "common.schema.json#/$defs/sources"},
    "summary": {"type": "string", "minLength": 1, "description": "Our paraphrase of the correction"},
    "patches": {"type": "array", "minItems": 1, "items": {
      "type": "object", "required": ["op", "path"],
      "properties": {"op": {"enum": ["add", "remove", "replace"]}, "path": {"type": "string", "pattern": "^/"}, "value": {}},
      "if": {"properties": {"op": {"enum": ["add", "replace"]}}}, "then": {"required": ["value"]}
    }}
  }
}
